{
  "explorer": {
    "sort": {
      "type": "natural",
      "order": "asc",
      "field": "title"
    }
  },
  "folderPage": {
    "sort": {
      "type": "date",
      "order": "desc",
      "field": "date"
    }
  },
  "backlinks": {
    "hideWhenEmpty": false,
    "sort": {
      "type": "date",
      "order": "desc",
      "field": "date"
    },
    "aggregation": [
      { "type": "folder", "depth": 1 },
      { "type": "date", "field": "date", "granularity": "year" },
      { "type": "field", "field": "type" }
    ]
  },
  "graph": {
    "coreNodeFilter": [
      { "type": "folder", "depth": 1, "values": ["组织"] }
    ],
    "coreNodeLimit": 50,
    "regionRules": [
      { "type": "field", "field": "客户" }
    ],
    "aggregation": [
      { "type": "folder", "depth": 1 },
      { "type": "field", "field": "tags" },
      { "type": "field", "field": "type" }
    ]
  }
}
